{
  "$schema": "https://json-schema.org/draft/2020-12/schema", "$id": "urn:foi-o:schema:bounded-pilot-analyst-execution-request:0.2.0", "type": "object", "additionalProperties": false,
  "required": ["schema_version", "request_id", "status", "protocol", "readiness", "codebook", "derivation_result", "scope", "roles", "isolation", "authorization_present", "derived_text_read_allowed", "context_materialization_allowed", "context_presentation_allowed", "analyst_execution_allowed", "reconciliation_allowed", "execution_allowed", "empirical_claims_allowed", "empirical_result_approval_allowed", "population_inference_allowed", "archive_wide_claim_allowed", "human_reviewed", "gold_eligible", "publication_allowed", "release_allowed", "paper_updates_allowed", "local_only", "clean_head_pre_execution_verification_required", "separate_reconciliation_permission_required"],
  "properties": {
    "schema_version": {"const": "foi-o.bounded-pilot-analyst-execution-request.v0.2.0"}, "request_id": {"const": "bounded-pilot-11872-35076-agent-analysis-v0.2"}, "status": {"const": "pending_exact_context_and_analyst_execution_approval"},
    "protocol": {"type": "object"}, "readiness": {"type": "object"}, "codebook": {"type": "object"}, "derivation_result": {"type": "object"}, "scope": {"type": "object"}, "roles": {"type": "object"},
    "isolation": {"type": "object", "additionalProperties": false, "required": ["identical_contexts", "analysts_independent", "peer_outputs_hidden_until_both_locked", "candidate_labels_and_prior_reviews_hidden", "reconciler_blocked_until_both_locks_verify", "analyst_records_immutable_after_lock"], "properties": {"identical_contexts": {"const": true}, "analysts_independent": {"const": true}, "peer_outputs_hidden_until_both_locked": {"const": true}, "candidate_labels_and_prior_reviews_hidden": {"const": true}, "reconciler_blocked_until_both_locks_verify": {"const": true}, "analyst_records_immutable_after_lock": {"const": true}}},
    "authorization_present": {"const": false}, "derived_text_read_allowed": {"const": false}, "context_materialization_allowed": {"const": false}, "context_presentation_allowed": {"const": false}, "analyst_execution_allowed": {"const": false}, "reconciliation_allowed": {"const": false}, "execution_allowed": {"const": false}, "empirical_claims_allowed": {"const": false}, "empirical_result_approval_allowed": {"const": false}, "population_inference_allowed": {"const": false}, "archive_wide_claim_allowed": {"const": false}, "human_reviewed": {"const": false}, "gold_eligible": {"const": false}, "publication_allowed": {"const": false}, "release_allowed": {"const": false}, "paper_updates_allowed": {"const": false}, "local_only": {"const": true}, "clean_head_pre_execution_verification_required": {"const": true}, "separate_reconciliation_permission_required": {"const": true}
  }
}
