{
  "schema_version": "foi-o.bounded-pilot-analyst-execution-request.v0.2.0",
  "request_id": "bounded-pilot-11872-35076-agent-analysis-v0.2",
  "status": "pending_exact_context_and_analyst_execution_approval",
  "protocol": {"path": "docs/43-v2-analyst-empirical-validation-protocol.md", "sha256": "1ff93755f9beccb86fe4b3bd67388c68e2202ec62c6ca1848aa01a9157b6d65f"},
  "readiness": {"path": "examples/v2/bounded-pilot-execution-input-readiness.v0.2.approved.json", "sha256": "8c126a01b6fc2b35f3501d7b5c4d3ba29517a41d7a495efd1bf9986003930004", "repository_commit": "17c7c2d784c84c2b127f6d65a1609025ccb80fbb"},
  "codebook": {"path": "examples/v2/bounded-pilot-blinded-codebook.pending.json", "sha256": "2848b675b63231d97fb4d47f5b8bdff4cd1e9947676ed50af80dbaa0e128bde9"},
  "derivation_result": {"path": "examples/v2/bounded-pilot-attachment-mutool-derivation-result.1.json", "sha256": "271a15a0f93451be4db2d35be0721c16734d0e643d8d04a5dfb421fb1bd4eded", "repository_commit": "f5d59d22a77240db72884a2bedcffcbb731ea59d"},
  "scope": {"request_ids": ["11872", "35076"], "sampling": "purposive_two_case_pilot", "claims": "case_level_feasibility_only"},
  "roles": {
    "analyst_a": {"actor_id": "agent:bounded-pilot-analyst-a", "actor_class": "automated_agent", "role": "analyst", "canonical_locator": "/root/bounded_pilot_analyst_a", "runtime": "OpenAI Codex agent; exact snapshot and session UUID to be recorded by pre-execution handshake", "prompt": {"path": "examples/v2/bounded-pilot-analyst-prompts/analyst-a.v0.2.txt", "sha256": "09a27242cc3fac79dd6a5e22642fc19c859b54ead1b155358e944f449ce92575"}},
    "analyst_b": {"actor_id": "agent:bounded-pilot-analyst-b", "actor_class": "automated_agent", "role": "analyst", "canonical_locator": "/root/bounded_pilot_analyst_b", "runtime": "OpenAI Codex agent; exact snapshot and session UUID to be recorded by pre-execution handshake", "prompt": {"path": "examples/v2/bounded-pilot-analyst-prompts/analyst-b.v0.2.txt", "sha256": "e915da3e0ccbc53f19d3d268afd51a084d5c181839851b4002a5953752530d16"}},
    "reconciler": {"actor_id": "agent:bounded-pilot-reconciler", "actor_class": "automated_agent", "role": "reconciler", "canonical_locator": "/root/bounded_pilot_reconciler", "runtime": "OpenAI Codex agent; exact snapshot and session UUID to be recorded only after analyst locks", "prompt": {"path": "examples/v2/bounded-pilot-analyst-prompts/reconciler.v0.2.txt", "sha256": "0eff8e62f3dd0c298c0de6ee81121d3e905a17964d89604af6756790bdc9b849"}}
  },
  "isolation": {"identical_contexts": true, "analysts_independent": true, "peer_outputs_hidden_until_both_locked": true, "candidate_labels_and_prior_reviews_hidden": true, "reconciler_blocked_until_both_locks_verify": true, "analyst_records_immutable_after_lock": true},
  "authorization_present": false,
  "derived_text_read_allowed": false,
  "context_materialization_allowed": false,
  "context_presentation_allowed": false,
  "analyst_execution_allowed": false,
  "reconciliation_allowed": false,
  "execution_allowed": false,
  "empirical_claims_allowed": false,
  "empirical_result_approval_allowed": false,
  "population_inference_allowed": false,
  "archive_wide_claim_allowed": false,
  "human_reviewed": false,
  "gold_eligible": false,
  "publication_allowed": false,
  "release_allowed": false,
  "paper_updates_allowed": false,
  "local_only": true,
  "clean_head_pre_execution_verification_required": true,
  "separate_reconciliation_permission_required": true
}
